Tên người nhận xét,Đánh giá,Nội dung,Thời gian
Nguyễn Văn A,5,Đồ ăn ngon chất lượng,15/10/2025 12:30
Trần Thị B,4,Phục vụ nhanh,14/10/2025 11:15
Phạm Hữu C,4,Vị đạt chuẩn,13/10/2025 13:45
Hoàng Mỹ D,5,Sạch sẽ an toàn,12/10/2025 10:30
Lê Công E,3,Hơi bận lúc ăn trưa,11/10/2025 12:20
Vũ Thị F,5,Giá vừa vặn,10/10/2025 11:50
Đỗ Hồng G,4,Đúng chuẩn Việt,09/10/2025 13:10
Bùi Minh H,5,Nguyên liệu tươi mới,08/10/2025 10:45
Dương Thị I,4,Phục vụ chu đáo,07/10/2025 12:35
Phan Văn K,4,Quán sạch sẽ,06/10/2025 11:20
Tạa Quốc L,5,Cơm tấm ngon tuyệt,05/10/2025 13:40
Nông Thị M,4,Canh chua tuyệt vời,04/10/2025 10:15
Mã Văn N,5,Nem rán đặc biệt,03/10/2025 12:50
Mạc Thị O,4,Chủ quán lựa chọn kỹ,02/10/2025 11:30
Quách Minh P,4,Hương vị truyền thống,01/10/2025 13:05
Trịnh Thị Q,5,Địa điểm favorite gia đình,30/09/2025 10:40
Sử Văn R,4,Đồ ăn luôn ngon,29/09/2025 12:25
Tôn Thị S,5,Tươi mới hằng ngày,28/09/2025 11:10
Ứ Văn T,4,Yêu cầu đặc biệt nhớ,27/09/2025 13:35
Vương Thị U,4,Không quá đắng,26/09/2025 10:50
Nguyễn Văn A,5,Mỹ vị không phải gì,25/09/2025 12:15
Trần Thị B,4,Cơm tấm canh chua,24/09/2025 11:45
Phạm Hữu C,4,Nem rán tuyệt ngon,23/09/2025 13:20
Hoàng Mỹ D,5,Vệ sinh căn bản sạch,22/09/2025 10:30
Lê Công E,4,Quán nhỏ nhưng ngon,21/09/2025 12:40
Vũ Thị F,5,Khách quen hay tới,20/09/2025 11:15
Đỗ Hồng G,4,Hương vị không khô,19/09/2025 13:50
Bùi Minh H,5,Những người lạ hài lòng,18/09/2025 10:25
Dương Thị I,4,Bạn giới thiệu tuyệt,17/09/2025 12:35
Phan Văn K,4,Mình là khách thường xuyên,16/09/2025 11:05
Tạa Quốc L,5,Bơi thoáng không khí,15/09/2025 13:40
Nông Thị M,4,Chỗ ngồi thoải mái,14/09/2025 10:15
Mã Văn N,5,Đồ ăn rất ngon tuyệt,13/09/2025 12:50
Mạc Thị O,4,Hương vị đặc biệt,12/09/2025 11:20
Quách Minh P,4,Công thức bí mật,11/09/2025 13:10
Trịnh Thị Q,5,Nhân viên tận tình,10/09/2025 10:45
Sử Văn R,4,Đồ ăn không bị hỏng,09/09/2025 12:30
Tôn Thị S,5,Lâu lâu ghé thử,08/09/2025 11:00
Ứ Văn T,4,Vị truyền thống lâu,07/09/2025 13:25
Vương Thị U,4,Phục vụ tự nhiên,06/09/2025 10:40
Nguyễn Văn A,5,Quán này tuyệt vời,05/09/2025 12:15
Trần Thị B,4,Đồ ăn lúc nào ok,04/09/2025 11:35
Phạm Hữu C,4,Giá cạnh tranh,03/09/2025 13:45
Hoàng Mỹ D,5,Sạch sẽ yên tâm,02/09/2025 10:20
Lê Công E,3,Bình thường nhưng tốt,01/09/2025 12:55
Vũ Thị F,5,Nguyên liệu tươi,31/08/2025 11:15
Đỗ Hồng G,4,Phục vụ nhanh lẹ,30/08/2025 13:40
Bùi Minh H,5,Vệ sinh an toàn,29/08/2025 10:30
Dương Thị I,4,Chủ quán tử tế,28/08/2025 12:20
Phan Văn K,4,Đồ ăn đặc biệt,27/08/2025 11:50
Tạa Quốc L,5,Quán này là yêu thích,26/08/2025 13:10
Nông Thị M,4,Cơm tấm không bẩn,25/08/2025 10:45
Mã Văn N,5,Người khác hài lòng,24/08/2025 12:35
Mạc Thị O,4,Hương vị đặc biệt,23/08/2025 11:15
Quách Minh P,4,Đồ ăn tuyệt vời